MessageID,Sent_From,Sent_To,message
1,john_doe,jane_smith,"Hey, are we still meeting for the project tomorrow?"
2,jane_smith,john_doe,"Yes, let's meet at the coffee shop at 2 PM."
3,mike_brown,alice_jones,"Can you send me the latest report?"
4,alice_jones,mike_brown,"Sure, I'll upload it to our shared drive in a few minutes."
5,bob_wilson,sarah_davis,"Did you get a chance to review the marketing proposal?"
6,sarah_davis,bob_wilson,"I did, and I have some suggestions. Let's discuss during our next meeting."
7,tom_miller,emma_white,"Congratulations on your promotion!"
8,emma_white,tom_miller,"Thanks! It was a lot of hard work, but totally worth it."